StartDate,EndDate,Status,IPAddress,Progress,Duration (in seconds),Finished,RecordedDate,ResponseId,RecipientLastName,RecipientFirstName,RecipientEmail,ExternalReference,LocationLatitude,LocationLongitude,DistributionChannel,UserLanguage,Q1.2,Q1.3,Q1.4,Q1.5,Q2.1_1,Q2.1_2,Q2.1_3,Q2.1_4,Q2.1_5,Q2.1_6,Q2.1_7,Q2.1_8,Q2.1_9,Q2.1_10,Q2.1_11,Q2.1_12,Q2.1_13,Q2.1_14,Q2.1_15,Q2.1_16,Q2.1_17,Q2.1_18,Q2.1_19,Q2.1_20,Q2.1_21,Q2.1_22,Q2.1_23,Q2.1_24,Q2.1_25,Q2.1_26,Q2.1_27,Q2.1_28,Q2.1_29,Q2.1_30,Q2.1_31,Q2.1_32,Q2.1_33,Q2.1_34,Q2.1_35,Q2.1_36,Q2.1_37,Q2.1_38,Q2.1_39,Q2.1_40,Q2.1_41,Q2.1_42,Q2.1_43,Q2.1_44,Q2.2_First Click,Q2.2_Last Click,Q2.2_Page Submit,Q2.2_Click Count,Q3.1_1,Q3.1_2,Q3.1_3,Q3.1_4,Q3.1_5,Q3.1_6,Q3.1_7,Q3.1_8,Q3.1_9,Q3.1_10,Q3.1_11,Q3.1_12,Q3.1_13,Q3.1_14,Q3.2_First Click,Q3.2_Last Click,Q3.2_Page Submit,Q3.2_Click Count,Q5.1,Q5.2_First Click,Q5.2_Last Click,Q5.2_Page Submit,Q5.2_Click Count,Q7.1,Q7.2_First Click,Q7.2_Last Click,Q7.2_Page Submit,Q7.2_Click Count,Q8.1,Q8.2_First Click,Q8.2_Last Click,Q8.2_Page Submit,Q8.2_Click Count,Q10.1,Q10.2_First Click,Q10.2_Last Click,Q10.2_Page Submit,Q10.2_Click Count,Q12.1,Q12.2_First Click,Q12.2_Last Click,Q12.2_Page Submit,Q12.2_Click Count,Q14.1,Q14.2_First Click,Q14.2_Last Click,Q14.2_Page Submit,Q14.2_Click Count,Q16.1,Q16.2_First Click,Q16.2_Last Click,Q16.2_Page Submit,Q16.2_Click Count,Q18.1,Q18.2_First Click,Q18.2_Last Click,Q18.2_Page Submit,Q18.2_Click Count,Q19.1_1,Q19.1_6,Q19.1_2,Q19.1_7,Q19.1_3,Q19.2_First Click,Q19.2_Last Click,Q19.2_Page Submit,Q19.2_Click Count,Q99#1_1,Q99#2_1,Q100#1_1,Q100#1_2,Q100#1_3,Q100#1_4,Q100#1_5,Q100#1_6,Q100#1_7,Q100#1_8,Q100#1_9,Q100#1_10,Q100#1_11,Q100#1_12,Q100#1_13,Q100#1_14,Q100#1_15,Q100#1_16,Q100#1_17,Q100#1_18,Q100#1_19,Q100#1_20,Q100#1_21,Q100#1_22,Q100#1_23,Q100#1_24,Q100#2_1,Q100#2_2,Q100#2_3,Q100#2_4,Q100#2_5,Q100#2_6,Q100#2_7,Q100#2_8,Q100#2_9,Q100#2_10,Q100#2_11,Q100#2_12,Q100#2_13,Q100#2_14,Q100#2_15,Q100#2_16,Q100#2_17,Q100#2_18,Q100#2_19,Q100#2_20,Q100#2_21,Q100#2_22,Q100#2_23,Q100#2_24,Q20.3_First Click,Q20.3_Last Click,Q20.3_Page Submit,Q20.3_Click Count,survey_code
Start Date,End Date,Response Type,IP Address,Progress,Duration (in seconds),Finished,Recorded Date,Response ID,Recipient Last Name,Recipient First Name,Recipient Email,External Data Reference,Location Latitude,Location Longitude,Distribution Channel,User Language,"I am age 18 or older, I have read and understood the information above, I want to participate in this research and continue with the survey:",To which gender identity do you most identify?,What is your age?,"What is the highest degree or level of school you have completed? (If 
you’re currently enrolled in school, please indicate the highest degree 
you have received.)",I see myself as someone who is: - Is talkative,I see myself as someone who is: - Tends to find fault with others,I see myself as someone who is: - Does a thorough job,"I see myself as someone who is: - Is depressed, blue","I see myself as someone who is: - Is original, comes up with new ideas",I see myself as someone who is: - Is reserved,I see myself as someone who is: - Is helpful and unselfish with others,I see myself as someone who is: - Can be somewhat careless,"I see myself as someone who is: - Is relaxed, handles stress well",I see myself as someone who is: - Is curious about many different things,I see myself as someone who is: - Is full of energy,I see myself as someone who is: - Starts quarrels with others,I see myself as someone who is: - Is a reliable worker,I see myself as someone who is: - Can be tense,"I see myself as someone who is: - Is ingenious, a deep thinker",I see myself as someone who is: - Generates a lot of enthusiasm,I see myself as someone who is: - Has a forgiving nature,I see myself as someone who is: - Tends to be disorganized,I see myself as someone who is: - Worries a lot,I see myself as someone who is: - Has ana active imagination,I see myself as someone who is: - Tends to be quiet,I see myself as someone who is: - Is generally trusting,I see myself as someone who is: - Tends to be lazy,"I see myself as someone who is: - Is emotionally stable, not easily upset",I see myself as someone who is: - Is inventive,I see myself as someone who is: - Has an assertive personality,I see myself as someone who is: - Can be cold and aloof,I see myself as someone who is: - Preseveres until the task is finished,I see myself as someone who is: - Can be moody,"I see myself as someone who is: - Values artistic, aesthetic experiences","I see myself as someone who is: - Is sometimes shy, inhibited",I see myself as someone who is: - Is considerate and kind to almost everyone,I see myself as someone who is: - Does things efficiently,I see myself as someone who is: - Remains calm in tense situations,I see myself as someone who is: - Prefers work that is routine,"I see myself as someone who is: - Is outgoing, sociable",I see myself as someone who is: - Is sometimes rude to others,I see myself as someone who is: - Makes plans and follows through with them,I see myself as someone who is: - Gets nervous easily,"I see myself as someone who is: - Likes to reflect, play with ideas",I see myself as someone who is: - Has few artistic interests,I see myself as someone who is: - Likes to cooperate with others,I see myself as someone who is: - Is easily disracted,"I see myself as someone who is: - Is sophisticated in art, music, or literature",Timing - First Click,Timing - Last Click,Timing - Page Submit,Timing - Click Count,Click to write the question text - I would feel uneasy if robots really had emotions.,Click to write the question text - Something bad might happen if robots developed into living beings.,Click to write the question text - I would feel relaxed talking with robots.,Click to write the question text - I would feel uneasy if I was given a job where I had to use robots.,"Click to write the question text - If robots had emotions, I would be able to make friends with them.",Click to write the question text - I (would?) feel comforted being with robots that have emotions.,"Click to write the question text - The word ""robot"" means nothing to me.",Click to write the question text - I would feel nervous operating a robot in front of other people.,Click to write the question text - I would hate the idea that robots or artificial intelligence were making judgments about things.,Click to write the question text - I would feel very nervous just standing in front of a robot.,"Click to write the question text - I feel that if I depend on robots too much, something bad might happen.",Click to write the question text - I would feel paranoid talking with a robot.,Click to write the question text - I am concerned that robots would be a bad influence on children.,Click to write the question text - I feel that in the future society will be dominated by robots.,Timing - First Click,Timing - Last Click,Timing - Page Submit,Timing - Click Count,Which robot do you agree with?,Timing - First Click,Timing - Last Click,Timing - Page Submit,Timing - Click Count,Which robot do you agree with?,Timing - First Click,Timing - Last Click,Timing - Page Submit,Timing - Click Count,What does Liz enjoy doing?,Timing - First Click,Timing - Last Click,Timing - Page Submit,Timing - Click Count,Which robot do you agree with?,Timing - First Click,Timing - Last Click,Timing - Page Submit,Timing - Click Count,Which robot do you agree with?,Timing - First Click,Timing - Last Click,Timing - Page Submit,Timing - Click Count,Which robot do you agree with?,Timing - First Click,Timing - Last Click,Timing - Page Submit,Timing - Click Count,Which robot do you agree with?,Timing - First Click,Timing - Last Click,Timing - Page Submit,Timing - Click Count,Which robot do you agree with?,Timing - First Click,Timing - Last Click,Timing - Page Submit,Timing - Click Count,Click to write the question text - Which robot would you prefer?,Click to write the question text - Which robot would you trust to manage your investments portfolio?,Click to write the question text - Which robot do you think will serve as a good jury member?,Click to write the question text - Which robot do you think will be a better analyst?,Click to write the question text - Which robot would you like as a bartender?,Timing - First Click,Timing - Last Click,Timing - Page Submit,Timing - Click Count,In the question below you will be asked about the two robots. In each question the left column re... - Click to write Column 1 - Fake - Natrual,In the question below you will be asked about the two robots. In each question the left column re... - Click to write Column 2 - Fake - Natrual,Please rate your impression of the robot on these scales: - blue robot - Fake - Natrual,Please rate your impression of the robot on these scales: - blue robot - Machinlike - Humnalike,Please rate your impression of the robot on these scales: - blue robot - Unconscious - Conscious,Please rate your impression of the robot on these scales: - blue robot - Artificial - Lifelike,Please rate your impression of the robot on these scales: - blue robot - Moving rigidly - Moving elegantly,Please rate your impression of the robot on these scales: - blue robot - Dead - Alive,Please rate your impression of the robot on these scales: - blue robot - Stagnant - Lively,Please rate your impression of the robot on these scales: - blue robot - Mechanical - Organic,Please rate your impression of the robot on these scales: - blue robot - Artificial - Lifelike,Please rate your impression of the robot on these scales: - blue robot - Inert - Interactive,Please rate your impression of the robot on these scales: - blue robot - Apathetic - Responsive,Please rate your impression of the robot on these scales: - blue robot - Dislike - Like,Please rate your impression of the robot on these scales: - blue robot - Unfriendly - Friendly,Please rate your impression of the robot on these scales: - blue robot - Unkind - Kind,Please rate your impression of the robot on these scales: - blue robot - Unpleasant - Pleasant,Please rate your impression of the robot on these scales: - blue robot - Awful - Nice,Please rate your impression of the robot on these scales: - blue robot - Incompetent - Competent,Please rate your impression of the robot on these scales: - blue robot - Ignorant - Knowledgeable,Please rate your impression of the robot on these scales: - blue robot - Irresponsible - Responsible,Please rate your impression of the robot on these scales: - blue robot - Unintelligent - Intelligent,Please rate your impression of the robot on these scales: - blue robot - Foolish - Sensible,Please rate your impression of the robot on these scales: - blue robot - Anxious - Relaxed,Please rate your impression of the robot on these scales: - blue robot - Agitated - Calm,Please rate your impression of the robot on these scales: - blue robot - Quiescent - Surprised,Please rate your impression of the robot on these scales: - red robot - Fake - Natrual,Please rate your impression of the robot on these scales: - red robot - Machinlike - Humnalike,Please rate your impression of the robot on these scales: - red robot - Unconscious - Conscious,Please rate your impression of the robot on these scales: - red robot - Artificial - Lifelike,Please rate your impression of the robot on these scales: - red robot - Moving rigidly - Moving elegantly,Please rate your impression of the robot on these scales: - red robot - Dead - Alive,Please rate your impression of the robot on these scales: - red robot - Stagnant - Lively,Please rate your impression of the robot on these scales: - red robot - Mechanical - Organic,Please rate your impression of the robot on these scales: - red robot - Artificial - Lifelike,Please rate your impression of the robot on these scales: - red robot - Inert - Interactive,Please rate your impression of the robot on these scales: - red robot - Apathetic - Responsive,Please rate your impression of the robot on these scales: - red robot - Dislike - Like,Please rate your impression of the robot on these scales: - red robot - Unfriendly - Friendly,Please rate your impression of the robot on these scales: - red robot - Unkind - Kind,Please rate your impression of the robot on these scales: - red robot - Unpleasant - Pleasant,Please rate your impression of the robot on these scales: - red robot - Awful - Nice,Please rate your impression of the robot on these scales: - red robot - Incompetent - Competent,Please rate your impression of the robot on these scales: - red robot - Ignorant - Knowledgeable,Please rate your impression of the robot on these scales: - red robot - Irresponsible - Responsible,Please rate your impression of the robot on these scales: - red robot - Unintelligent - Intelligent,Please rate your impression of the robot on these scales: - red robot - Foolish - Sensible,Please rate your impression of the robot on these scales: - red robot - Anxious - Relaxed,Please rate your impression of the robot on these scales: - red robot - Agitated - Calm,Please rate your impression of the robot on these scales: - red robot - Quiescent - Surprised,Timing - First Click,Timing - Last Click,Timing - Page Submit,Timing - Click Count,survey_code
"{""ImportId"":""startDate"",""timeZone"":""America/Denver""}","{""ImportId"":""endDate"",""timeZone"":""America/Denver""}","{""ImportId"":""status""}","{""ImportId"":""ipAddress""}","{""ImportId"":""progress""}","{""ImportId"":""duration""}","{""ImportId"":""finished""}","{""ImportId"":""recordedDate"",""timeZone"":""America/Denver""}","{""ImportId"":""_recordId""}","{""ImportId"":""recipientLastName""}","{""ImportId"":""recipientFirstName""}","{""ImportId"":""recipientEmail""}","{""ImportId"":""externalDataReference""}","{""ImportId"":""locationLatitude""}","{""ImportId"":""locationLongitude""}","{""ImportId"":""distributionChannel""}","{""ImportId"":""userLanguage""}","{""ImportId"":""QID78""}","{""ImportId"":""QID79""}","{""ImportId"":""QID80_TEXT""}","{""ImportId"":""QID81""}","{""ImportId"":""QID102_1""}","{""ImportId"":""QID102_2""}","{""ImportId"":""QID102_3""}","{""ImportId"":""QID102_4""}","{""ImportId"":""QID102_5""}","{""ImportId"":""QID102_6""}","{""ImportId"":""QID102_7""}","{""ImportId"":""QID102_8""}","{""ImportId"":""QID102_9""}","{""ImportId"":""QID102_10""}","{""ImportId"":""QID102_11""}","{""ImportId"":""QID102_12""}","{""ImportId"":""QID102_13""}","{""ImportId"":""QID102_14""}","{""ImportId"":""QID102_15""}","{""ImportId"":""QID102_16""}","{""ImportId"":""QID102_17""}","{""ImportId"":""QID102_18""}","{""ImportId"":""QID102_19""}","{""ImportId"":""QID102_20""}","{""ImportId"":""QID102_21""}","{""ImportId"":""QID102_22""}","{""ImportId"":""QID102_23""}","{""ImportId"":""QID102_24""}","{""ImportId"":""QID102_25""}","{""ImportId"":""QID102_26""}","{""ImportId"":""QID102_27""}","{""ImportId"":""QID102_28""}","{""ImportId"":""QID102_29""}","{""ImportId"":""QID102_30""}","{""ImportId"":""QID102_31""}","{""ImportId"":""QID102_32""}","{""ImportId"":""QID102_33""}","{""ImportId"":""QID102_34""}","{""ImportId"":""QID102_35""}","{""ImportId"":""QID102_36""}","{""ImportId"":""QID102_37""}","{""ImportId"":""QID102_38""}","{""ImportId"":""QID102_39""}","{""ImportId"":""QID102_40""}","{""ImportId"":""QID102_41""}","{""ImportId"":""QID102_42""}","{""ImportId"":""QID102_43""}","{""ImportId"":""QID102_44""}","{""ImportId"":""QID103_FIRST_CLICK""}","{""ImportId"":""QID103_LAST_CLICK""}","{""ImportId"":""QID103_PAGE_SUBMIT""}","{""ImportId"":""QID103_CLICK_COUNT""}","{""ImportId"":""QID106_1""}","{""ImportId"":""QID106_2""}","{""ImportId"":""QID106_3""}","{""ImportId"":""QID106_4""}","{""ImportId"":""QID106_5""}","{""ImportId"":""QID106_6""}","{""ImportId"":""QID106_7""}","{""ImportId"":""QID106_8""}","{""ImportId"":""QID106_9""}","{""ImportId"":""QID106_10""}","{""ImportId"":""QID106_11""}","{""ImportId"":""QID106_12""}","{""ImportId"":""QID106_13""}","{""ImportId"":""QID106_14""}","{""ImportId"":""QID107_FIRST_CLICK""}","{""ImportId"":""QID107_LAST_CLICK""}","{""ImportId"":""QID107_PAGE_SUBMIT""}","{""ImportId"":""QID107_CLICK_COUNT""}","{""ImportId"":""QID83""}","{""ImportId"":""QID84_FIRST_CLICK""}","{""ImportId"":""QID84_LAST_CLICK""}","{""ImportId"":""QID84_PAGE_SUBMIT""}","{""ImportId"":""QID84_CLICK_COUNT""}","{""ImportId"":""QID85""}","{""ImportId"":""QID86_FIRST_CLICK""}","{""ImportId"":""QID86_LAST_CLICK""}","{""ImportId"":""QID86_PAGE_SUBMIT""}","{""ImportId"":""QID86_CLICK_COUNT""}","{""ImportId"":""QID104""}","{""ImportId"":""QID105_FIRST_CLICK""}","{""ImportId"":""QID105_LAST_CLICK""}","{""ImportId"":""QID105_PAGE_SUBMIT""}","{""ImportId"":""QID105_CLICK_COUNT""}","{""ImportId"":""QID87""}","{""ImportId"":""QID88_FIRST_CLICK""}","{""ImportId"":""QID88_LAST_CLICK""}","{""ImportId"":""QID88_PAGE_SUBMIT""}","{""ImportId"":""QID88_CLICK_COUNT""}","{""ImportId"":""QID90""}","{""ImportId"":""QID89_FIRST_CLICK""}","{""ImportId"":""QID89_LAST_CLICK""}","{""ImportId"":""QID89_PAGE_SUBMIT""}","{""ImportId"":""QID89_CLICK_COUNT""}","{""ImportId"":""QID92""}","{""ImportId"":""QID91_FIRST_CLICK""}","{""ImportId"":""QID91_LAST_CLICK""}","{""ImportId"":""QID91_PAGE_SUBMIT""}","{""ImportId"":""QID91_CLICK_COUNT""}","{""ImportId"":""QID94""}","{""ImportId"":""QID93_FIRST_CLICK""}","{""ImportId"":""QID93_LAST_CLICK""}","{""ImportId"":""QID93_PAGE_SUBMIT""}","{""ImportId"":""QID93_CLICK_COUNT""}","{""ImportId"":""QID96""}","{""ImportId"":""QID95_FIRST_CLICK""}","{""ImportId"":""QID95_LAST_CLICK""}","{""ImportId"":""QID95_PAGE_SUBMIT""}","{""ImportId"":""QID95_CLICK_COUNT""}","{""ImportId"":""QID108_1""}","{""ImportId"":""QID108_6""}","{""ImportId"":""QID108_2""}","{""ImportId"":""QID108_7""}","{""ImportId"":""QID108_3""}","{""ImportId"":""QID109_FIRST_CLICK""}","{""ImportId"":""QID109_LAST_CLICK""}","{""ImportId"":""QID109_PAGE_SUBMIT""}","{""ImportId"":""QID109_CLICK_COUNT""}","{""ImportId"":""QID99#1_1""}","{""ImportId"":""QID99#2_1""}","{""ImportId"":""QID100#1_1""}","{""ImportId"":""QID100#1_2""}","{""ImportId"":""QID100#1_3""}","{""ImportId"":""QID100#1_4""}","{""ImportId"":""QID100#1_5""}","{""ImportId"":""QID100#1_6""}","{""ImportId"":""QID100#1_7""}","{""ImportId"":""QID100#1_8""}","{""ImportId"":""QID100#1_9""}","{""ImportId"":""QID100#1_10""}","{""ImportId"":""QID100#1_11""}","{""ImportId"":""QID100#1_12""}","{""ImportId"":""QID100#1_13""}","{""ImportId"":""QID100#1_14""}","{""ImportId"":""QID100#1_15""}","{""ImportId"":""QID100#1_16""}","{""ImportId"":""QID100#1_17""}","{""ImportId"":""QID100#1_18""}","{""ImportId"":""QID100#1_19""}","{""ImportId"":""QID100#1_20""}","{""ImportId"":""QID100#1_21""}","{""ImportId"":""QID100#1_22""}","{""ImportId"":""QID100#1_23""}","{""ImportId"":""QID100#1_24""}","{""ImportId"":""QID100#2_1""}","{""ImportId"":""QID100#2_2""}","{""ImportId"":""QID100#2_3""}","{""ImportId"":""QID100#2_4""}","{""ImportId"":""QID100#2_5""}","{""ImportId"":""QID100#2_6""}","{""ImportId"":""QID100#2_7""}","{""ImportId"":""QID100#2_8""}","{""ImportId"":""QID100#2_9""}","{""ImportId"":""QID100#2_10""}","{""ImportId"":""QID100#2_11""}","{""ImportId"":""QID100#2_12""}","{""ImportId"":""QID100#2_13""}","{""ImportId"":""QID100#2_14""}","{""ImportId"":""QID100#2_15""}","{""ImportId"":""QID100#2_16""}","{""ImportId"":""QID100#2_17""}","{""ImportId"":""QID100#2_18""}","{""ImportId"":""QID100#2_19""}","{""ImportId"":""QID100#2_20""}","{""ImportId"":""QID100#2_21""}","{""ImportId"":""QID100#2_22""}","{""ImportId"":""QID100#2_23""}","{""ImportId"":""QID100#2_24""}","{""ImportId"":""QID101_FIRST_CLICK""}","{""ImportId"":""QID101_LAST_CLICK""}","{""ImportId"":""QID101_PAGE_SUBMIT""}","{""ImportId"":""QID101_CLICK_COUNT""}","{""ImportId"":""survey_code""}"
2018-06-07 04:26:14,2018-06-07 04:37:07,0,172.56.42.23,100,653,1,2018-06-07 04:37:08,R_248jSr60q0E4zMP,,,,,47.248992919922,-122.53160095215,anonymous,EN,1,2,34,3,1,5,5,5,3,5,2,1,3,3,2,1,5,5,3,1,1,1,1,1,5,1,1,5,3,3,5,5,1,1,5,1,5,5,5,1,5,5,1,2,5,1,1,1,0,0,52.56,0,3,5,3,1,3,3,1,1,3,1,3,3,3,5,0,0,35.585,0,1,1,1,2.144,1,1,0.537,1.24,1.6,2,4,22.605,22.605,23.866,1,1,0.326,0.676,1.617,2,1,0.38,0.38,1.092,1,1,0.449,0.449,1.379,1,1,0.326,0.326,1.405,1,1,0.421,0.421,1.303,1,4,4,4,4,4,2.722,5.276,7.007,5,1,1,1,1,1,1,2,1,1,1,1,2,1,2,3,3,1,2,2,1,3,1,2,3,3,1,1,1,1,1,1,1,1,1,1,1,1,3,3,3,1,2,3,1,3,1,3,3,3,1,29.711,38.503,114.27,28,88670153
2018-06-07 04:27:15,2018-06-07 04:50:50,0,195.181.169.155,100,1415,1,2018-06-07 04:50:51,R_2q4YVOKOy4M9l69,,,,,40.721405029297,-74.00520324707,anonymous,EN,1,2,31,6,2,1,4,1,3,4,4,1,4,4,4,1,5,1,4,3,4,1,2,2,4,4,1,4,3,3,1,4,1,2,2,4,4,4,2,3,1,4,1,2,2,3,2,2,33.528,296.614,299.624,46,2,3,4,1,4,4,2,2,2,1,2,2,2,3,4.032,62.158,63.245,17,1,4.197,11.004,12.446,2,1,0.201,0.201,1.933,1,4,3.773,3.773,8.046,1,1,0.635,0.635,4.493,1,1,0.429,0.429,1.385,1,1,0.136,0.136,1.123,1,1,0.051,0.051,0.924,1,1,0.093,0.093,1.051,1,4,4,4,4,1,2.251,19.82,22.083,6,1,5,3,2,4,3,2,3,2,2,2,4,3,4,3,2,3,3,4,3,3,4,3,4,4,2,2,2,3,3,4,3,2,2,2,4,3,4,3,2,3,3,4,3,3,4,3,4,4,2,34.612,205.66,211.924,52,65031412
2018-06-07 04:42:12,2018-06-07 04:59:03,0,67.181.212.84,100,1010,1,2018-06-07 04:59:04,R_29tqGQIajUZLeeE,,,,,36.741104125977,-119.74990081787,anonymous,EN,1,2,30,2,2,3,3,2,3,4,3,3,3,3,2,2,3,3,3,3,4,4,2,3,4,4,3,3,3,4,3,3,3,3,4,4,3,3,3,2,3,3,3,3,3,3,3,3,42.471,85.386,87.359,58,2,2,4,2,4,4,4,2,3,3,3,3,3,3,6.627,37.963,39.524,17,2,1.158,1.158,2.556,1,2,0.537,0.537,1.312,1,4,5.842,5.842,7.152,1,1,0.52,0.52,1.414,1,1,0.27,0.27,1.096,1,1,0.372,0.372,1.359,1,1,1.065,1.065,1.883,1,1,0.552,0.552,1.474,1,4,4,4,4,4,2.632,4.339,5.448,5,3,3,3,3,3,4,3,3,3,3,3,3,3,3,3,3,3,3,4,4,4,4,4,3,3,3,4,4,4,4,4,4,4,4,4,4,4,4,4,4,4,4,4,4,4,4,4,4,4,4,10.763,62.582,63.565,68,99908119
2018-06-07 04:48:49,2018-06-07 05:06:56,0,97.81.21.184,100,1087,1,2018-06-07 05:06:56,R_2tJziYe9uwnAkKg,,,,,34.055999755859,-84.379501342773,anonymous,EN,1,1,51,4,1,1,5,2,4,5,5,2,4,4,4,1,5,2,4,4,5,1,4,4,5,5,1,4,4,2,1,5,2,4,4,5,5,4,4,2,1,5,4,4,1,5,2,4,3.876,90.378,95.792,47,4,4,2,2,2,2,2,4,4,2,4,4,2,2,7.978,70.668,71.154,15,1,3.864,3.864,5.033,1,1,1.123,1.123,2.666,1,4,6.883,6.883,11.397,1,1,0,0,1.744,1,1,0,0,1.142,0,1,0,0,0.911,0,1,0,0,1.043,0,1,0.649,0.649,1.76,1,4,4,4,4,1,2.503,12.079,13.149,5,1,5,1,1,1,1,1,3,3,1,1,4,3,3,4,4,4,5,4,4,5,4,3,2,3,3,2,2,2,2,1,3,3,1,1,4,3,3,4,4,4,5,4,4,5,4,3,2,3,3,156.076,358.687,373.352,61,47155778
2018-06-07 05:27:16,2018-06-07 05:45:58,0,71.8.86.183,100,1121,1,2018-06-07 05:45:59,R_9WWazB6nQFvh22l,,,,,33.351593017578,-86.821098327637,anonymous,EN,1,2,49,2,5,1,5,2,4,1,3,1,5,5,4,1,5,4,5,4,5,1,1,5,1,4,1,5,4,4,2,5,4,5,1,5,4,5,2,5,1,5,1,5,1,5,1,4,2.605,74.177,75.43,48,2,4,4,1,4,3,1,1,2,1,1,1,1,2,2.649,41.472,45.974,15,1,1.148,1.148,2.469,1,1,1.045,1.045,2.056,1,4,89.277,113.818,115.064,2,1,0.812,0.812,1.717,1,1,0.062,0.062,1.083,1,1,0,0,0.847,0,1,0.079,0.079,0.942,1,1,0,0,0.95,1,4,4,4,4,4,2.012,6.427,11.641,5,1,5,2,2,1,1,2,1,3,1,1,3,4,4,3,3,4,4,3,2,1,2,3,3,5,1,2,2,1,1,2,1,3,1,1,3,4,4,3,3,4,4,4,2,1,2,3,3,5,1,31.543,162.12,165.977,62,38439462
